Kapampangan,English
Cabcab,objects placed side by side
Cabeltun,fleshy inner part of banana trunk (used by children to wrap books)
Cab-Biyao,sugar mill
Cabibi,mussels; mussel shells used to produce lime
Cabid,a unit of cotton for spinning (four threads = one cauing; four cauings = one cabid)
Cabira,something of little importance or value
Cab-Bius,freeing oneself from required labor or obligation
Cab-Bla,to fail; to become faulty or defective
Cab-Bling,a tree with fragrant leaves
Cabocabo,stuffing material for cushions; also used as tinder
Cabu,pulse felt in the veins of the neck; vital movement
Cabug,sound of water when someone dives or swims into it
Cabud,at once; immediately; upon sight
Cabus,to finish; to complete; to use up entirely
Cabuti,mushroom; a type of fungus
Caca,older sibling (address used by younger siblings)
Cacas,Mansacas
Cacalbiling,a medicinal plant used against spasms or lockjaw
Cachumba,"a plant about three feet tall, used as a saffron substitute in dyeing"
Cadcad,to strip off; to peel away
Cagao,small insects causing itching or mange
Cai,Irregular verb of movement
Cait,"Transitive verb, to give sparingly, to live inafrugal manner, to be niggardly, to curtail, to lessen"
Caytana,Aknown tree
Caya,"Of doubt / wonder, or of choice"
Cayas,Mansavas
Cayat,"Man savat, to bite"
Cayli,"The left side, or the left hand"
Cayn?In,"Wide area of land or place cleared of trees, or any wild growth"
Cayocayo,"And micayocayo, the shaking of the shoulders by women of loose conduct, when they walk swaying their arms backwards as if on hinges, or are disjointed"
Cayud,Mansavud
Cayucut,Mansavucut
Cayumanggui,"Brownish, more brown {moreno) than fair-skinned"
Cayungcung,"To fold up or crumple down because of cold weather, also to warp, like leather or thin lumber when exposed to the sun; also said ofaherb calledpacayungcung"
Cayus,Smansavus
Cala,The shell ofatortoise / turtle
Calabcab,The blaze of fire
Calaboa,"A medicinal plant, used to treat gonorrhea, according to the Flora, page"
Calabucab,"A water snake, a non-venomous kind"
Calabit,"Mansalabit, to bind or fasten something hurriedly or loosely"
Calacal,Small sticks used in counting
Caladcad,A shovel used in heaping palay or garbage
Calad-Dua,Rational soul
Calagcag,Synonym of alaca
Calamba,"A large narrow mouthed pitcher, also known as Taboan"
Calambigas,"A gold figurine, rarely used"
Calambibit,"A well known plant, the seeds of which are used by boys in their games, and they are also used in medicine, according to the Flora, page"
Calamunding,"A tree belonging to the genus of citrus, of the species of lemons, whose fruits have pulps that are composed of segments similar to that of oranges, pomegranates, etc"
Calang,"A wedge used for tightening the posts / feet ofatable, chair, etc"
Calangcalan?An,"Small shellfish, or mussels, much smaller than the cabibi"
Calangan,Small railings
Calangdasal,"A thing used to wedge, spur; it could be of wood, like those used to wedge or spur the banca when it is stored in the shed: it could be of stones"
Calangcang,Something noisy tied toadogs tail
Calansag,"Man?alansag, the plates that fall off the shelf / plate stand, and they break into pieces"
Calansing,"Clang or sound of clashing swords, and of anything that produce such sound"
Calantas,"Fragrant wood, similar to tindalo, or even cedar, (pc"
Calantipay,Species of oysters
Calao,"To slacken, to loosen, not that it is tied, but that it is tight, likeadress, or an object that has wedges"
Calap,"Cuts of wood, bamboo, or rattan"
Calapayan,"A kind of bier with shafts made of bamboo, on which they carry the dead"
Calaputput,"Large strong root, trunk"
Calaro,"Used withanegation: Ecalaro, Virgin, ecalaro, chaste"
Calasag,"Round shield, cuirass, breastplate, and backplate, the armour"
Calascas,"Sound, like that ofasword being drawn from its scabbard, or that of machete when drawn against another inagame"
Calat,Manealat
Calatung,A timbrel made of bamboo
Calauang,"Rust of iron, or fatty substance on the surface of the water, or dross on the surface of teeth"
Calauat,Icalauat
Calauit,Icalauit
Calbit,"A signal, tapping withafinger or two, or giving the elbow"
Calcal,"Synonym of Calcay, to scratch up or stoke up"
Callat,A herb which bears fruit sim ilar to grapes
Calyat,a fruit resembling grapes
Calicam,incarnate; flesh-colored (rarely used)
Calicasuc,"thick, strongly scented smoke or vapor"
Calicubac,dandruff; scabby crust of the scalp
Caligag,dandruff; scabby head crust (synonym of calicubac)
Caligquig,chills; shivers from cold or fright
Calilip,overlapping; folded over
Calilin?O,arrogance; haughtiness
Caling,door bolt; crossbar latch
Calingad,a fragrant tree with cinnamon-scented bark
Caliqui,tickling sensation
Calis,sword or dagger
Calisip,rice plant at the stage just before blooming
Calisquis,fish scales; flakes on the shins or legs of fowl
Calit,"creaking or squeaking sound (bed, chair, dog paws on floor)"
Calius,"A common and well known tree; for its usefulness, see the Flora, page"
Calma,"Fate, luck, good or bad"
Calo,pulley; tackle (ropes and pulleys system)
Calluas,"Rattan casings, like that ofalarge porcelain jar"
Calubcub,A tree with this name
Calucabcab,"To become detached, like the meat of the coconut detached inside the shell, or the grain of the hazel nut"
Calucu,Flameof fire
Calucub,"A very low hut / cabin, and the roost of the denos, which is of similar make"
Calug,"To search, not for fruits, but in the manner of one who goes to the kitchen after having taken meals, to take whatever remains in the pots, or on the plates, and eat again"
Calulu,"Unfortunate, unhappy, distressed, destitute, miserable"
Calung,"Secundines, or secondines, the afterbirth"
Calumpang,A tree with first- class wood
Calucup,Mansalupcup
Calus,a strickle (flat tool for leveling grain in a measure)
Caluscus,"cracks, chinks, or fissures through which something falls into mud or water escapes to the fields"
Calut,Mansalut
Calutcut,"To look closely, to search for meticulously, or trace with utmost diligence"
Camacama,"Frequentative, and micamacama, become bewildered, stunned, panicky"
Camagui,A golden figure
Camang,"Brace, like, ofabox, to make it firm, a clamp"
Camansa,"A lean tree about nine feet tall, well known and pernicious, according to the Flora, page"
Camangian,"Kidney beans, string beans"
Caman-N?Ian,"A resinous substance similar to incense, frankincense; I am not sure if it is myrrh"
Camantigui,"A herb and its flowers, well known, in appearance; similar toarose"
Camayan?An,"Where the wind tends to blow easily, they say: camayan?aning an?in"
Camas,"Micamas, micamas, to flare up in anger, to lose patience, fly intoarage"
Camasa,"Ecamasa, unceasingly / without cease, relentlessly"
Camaso,"A tree well known, and useful in many ways according to the Flora, page"
Camauo,"The fist, the hand closed tightly"
Cambal,twins; two born together; paired fruits in one peel
Cambang,"A flower half-opened, orafruit about to come out from flower"
Cambing,A goat
Camcam,"A tree whose sap /tar causes pimples, itchings"
Camtan,To achieve
Campi,"A faction, party; partiality, guild, a society"
Campil,"A wrapper made of leaves of the palm, used in making suman"
Campit,"Aknife used in cutting up betel nuts, or paring offaquill"
Campo,"Mipacamp, being at ease, either sleeping, or seated"
Campul,"Micampul campul, like Micampil campil"
Campung,"Dominated, lorded over, be heaperson, or be italand"
Can,"Mangan, to eat, something that was no breathe, opposite of Masan, eat something that was alive, like, fish, meal"
Cana,Falsityof weights
Canao,"Alleviation, ease, widening of place or space"
Canaul,A known bird
Cancung,"A herb that grows and creeps on the water, good for the venison"
Canda,a fragrant yellow flower; a term of endearment
Canduli,A fish called by this name
Candung,Mansandims
Candut,"A little pinch, a small bit, or piece"
Can?Ay,"One invited toabanquet, or celebration"
Canlalamat,A venomous snake
Canlang,"A small drum, or timbrel"
Canlas,The incoming official
Canlong,"Place of safety, a guarded or defended place"
Cano,"Allegedly, to make allegations"
Cansao,"Cansao, little bars with which they putafence around their houses"
Cansong,Mansansons
Can-Nyao,To rinse by dipping it in the water
Canuan,The forehead
Canugtug,"A wild duck, withacrest like that ofacock; its meat is delicious to eat"
Capa,Mangapa
Capayan,"Opulence, affluence, wealth"
Capal,"Grossness, thickness"
Capapacanan,"M aqui quepapacanan, a thing that is useful; alan quepapacanan, it serves for nothing, from the point of view of the speaker"
Capatad,Brother
Capcap,Mansapcap
Capin,"Anything which is apart, which is not involved with other things; that has nothing to do with other things"
Capis,"Seashells, Verb, mamapis"
Capit,"Made of clay, or mud"
Capul,Capulan
Capuput,"A certain finish or form of finger rings, which are in vogue currently"
Carayom,"A needle, be itapointed bamboo stick"
Carampatan,"Medium, not big, nor small, not long, nor short"
Carang,"Awning ofabanca, a boat awning"
Caras,"M icaras, to make haste"
Carin,Adverbof place
Carit,A curved knife which is used by the manuba
Caro,"The poison taking effect, like the venom ofasnakebite reaching the heart"
Carug,"N eutral verb, the heart palpitating due to fright"
Caruru,A stick used in rolling tobacco
Carurun?An,"Magcarurm?an, one who treates or give deference toarespectable person"
Casa,False crystalline stones
Casacasa,"Of when, if, in case"
Casay,"Magcasay, reciprocal, to lie supine, stretched"
Casao,Movements of the fish on the surface of the water
Casat,"That which has wallowed in the dust, or mud"
Cascas,Friction
Casi,Friend
Casili,a diving bird similar to a cormorant
Casing,Synonym of Caling
Caso,"The shaking or wiggling ofathing that is badly wedged, aptly said of the braces ofacoach"
Caracata,Thousands upon/and thousands
Catag,"Catag catag, frequentative, also said of one trembling with fear, when shocked grievously"
Catay,"Past, Quinatay, what is done with sluggishness"
Catam,Carpenters plane
Catang,"C atngctang, or, micatngctang, to roll, or to gyrate what is struck, like, a ball"
Catat,"Mans atat, to skin, to flay"
Catauan,The body
Catcat,Mansatcat
Cati,"A unit of weight used in this land, which is 20 ounces; ten catis is one chinanta (about 15 av"
Catiban,"A mistake inadeal, in word or action"
Caticat,Mansaticat
Caticut,"To pierce, or bore with the point ofaknife"
Catig,"Those bamboos fastened to the sides ofaboat, like, the catigs of our bancas"
Cating,"Mecatingcating, said of that which is left dry, like the beach, or the fields for lack of water., or ofanarrow mouthed pitcher that used to be full of Pacatingcatin?an, water"
Catmon,A wild tree that bears orange-like fruits which are very sour
Catug,Man?atug
Catuyan?An,"Common noun, for parents-in law; the siblings and cousins of the parents-in law are also called, catuyan?an"
Catulunan,"A witch, hag"
Catung,"Catungcatung, one who is there alone forajob/task that needs to be done"
Catut,"Emicatut, said of one who could not move becauseof constriction or forcible detention"
Caua,A large carajay/ bronze pan
Cauad,A string wire
Cauay,"Past, Queuay, what is carried or waved thus, like clothes"
Cauayan,"The bamboo, or its species"
Caual,Maneaual
Cauala,"Magcauala, or migcauala, or, mipagcauala, to become divorced, or separated, like married couples, or illicit partners, also, friends"
Cauali,A small carajay
Cauan,"Withawoeful interjection, saidof an unfortunate incident, orof a misfortune"
Cauang,"A thing broken apart, like havingacrack, orajoint not well fitted"
Cauani,To separate from another
Caul,Mansaul
Caung,The dog barks
Cocao,to dip the hand into water to retrieve something at the bottom
Cauasa,"E cauasa, without ceasing"
Cauat,That with which
Cauig,"Cauigcauig, frequentative, Picauigcauigan moya"
Cauil,An object carried under the arm over the hip bone
Cauing,"An object that is clasped, like, a hook clasped to an eye, and one who carriesajug in each hand is said as Micauingya; it is Mi, transitive, one who is linked to another, or joined to each other, as though chained together"
Cauit,"A hook, grapple hook"
Cua,A little pistol
Cuaqui,Icuaqui
Cubcub,"Mamubcub, to surround with people, or with trenches / ditches, or fishpen"
Cubo,a hut in the middle of rice fields used to scare away birds
Cubug,"A loud thudding sound, like thatof a troopof cavalry"
Cubut,A little fish pen
Cucuc,"Cackling of hens, not when they have just finished laying an egg, which is malpatoc, but when they have their chicks"
Cucung,"To shrink, like, lumber, which warps under the heat of the sun, or the washed clothes which crease under the heat of the sun"
Cudiapi,A musical instrument similar toaharp
Cudta,"Micudta, micucudta, one who invents, or composesaliterary work or verses"
Cuy,"Cuycuy, icuvcuv"
Cuya,"Shortness, (material, not stature)"
Cuyam,"Cuyamcuyam, astir, like worms inafestering wound"
Cuyap,"Cuyapcuyap, to hardly appear, like that little you can perceive of an object that is submerged, but not totally covered by the water"
Cuyug,"Inseparable partner, like, a pair of doves, and from this, the one who always tag along with another isacuyug, cacuyugcuyug, exaggeratively"
Culabit,Synonym of alabil
Culacling,"A species of bird, the thrush with red eyes"
Culayadiang,"Ebony, ebonywood"
Culaing,"A French horn, here it is made of bamboo"
Culayo,The owl
Culala,Interjection of joy
Culam,W itch craft
Culamut,"To spread roots, like, a baliti tree"
Culang,faulty; defective; lacking
Culapad,Intestinal worms (amoeba)
Culapo,"Molds or moss, that appear on stones or in preserved foods"
Culaput,Culaputan
Culapsing,The minutest portion
Culasa,"Magculas, be resolute in sinning withawoman, with great gratification over the sin, and in proximate danger of pollution, achieving it or not, like magtalas"
Culasisi,"A parakeet, or small bird"
Culat,"Like, oil on the water, or seep through, like on paper"
Culatay,Mamulatav
Calatcat,"Any long and slender thing, likeareed or cane, twig, or small tree"
Culatic,Pangalatican or vansulatican
Culauit,to shout to someone very far away
Culcul,"A hole in the ground, not deep, but like those on the road that is not smooth or plain, or level, or even"
Culda,"Green, likeafruit, in its early stage"
Culdap,"Culdapculdap, said of what passes before ones eyes with great brevity, like, the lightning"
Culdas,That which or one who steps down
Culi,"To incline, or to tend to, or what comes to one by nature or heredity"
Culiling,The cord of the Gaud (oar)
Culimlim,"A dark object, or badly tinted/dyed"
Culipat,A red feathered bird of prey
Culipatpat,M ovement of the Lipatpat (glow worm)
Culis,"A tree, which producesayellow dye, used in tinting ebos"
Culisac,Synonym of Acclis
Culisap,Louse bigger than the Cumad
Culit,Fne points in Pampango handwriting
Culub,"A covering, pot lid"
Culubung,"Mag, reciprocal, maeculubum"
Culug,"Thunderclap or sound, noise that is hardly perceived"
Culumbo,Tent-like curtain (mosquito net)
Culumpis,Maneulumpis
Culung,"Swellings of the lymph glands, dry ones, including those in the neck; neutral verb, the appearing ofaswollen lymph gland, manuluvavan"
Culurun,"Wrinkle, crease, like on the forehead, or onacloth"
Culus,"Swishing sound, like, that of swishing silk or taffeta clothes"
Culut,"Curled, curly kinky"
Culutculutan,A well known bush
Culuung,Distiller inatavern
Cul-Lyauan,A golden oriole
Cumcum,Icumcum
Cumit,"Past, Quimit"
Cumpay,Grass/fodder given to horses
Cumpal,"Cumpal, or micumpal cumpal, when they are inaswarm, or in heaps, like, swarming ants, oramultitude, even of people"
Cumpas,A little stick or rod with which to goadahorse
Cumpit,"That which is guarded tenaciously, like the money, orasecret"
Cumpul,Synonym of Cumpal
Cumul,to chew with mouth closed; eating discreetly as if hiding something
Cumun,"Manzumun, to carryachild in the arms, like one being taken to be baptized"
Cumus,"Cumusan, quimusan"
Cundarit,"M an?undarit, man?un?undarit, men?undarit, to show/ manifest happiness and joy, like, toafriend whom we finally meet, after missing him foralong time, or when children come out with gesticulations and gestures of joy to meet their father who is returning home fromalong travel or journey, or those provocative affectations that women make with men to incite them to evil, or when one comes withawide smile to ask for something"
Cundilat,The spleen or the pancreas ofabeast
Cupia,"Magcupia, to useahat"
Cupit,Mansupit
Curacura,"A lean-on for shafts and crutches, or for muskets"
Cural,"Dirtiness, grime on the face, or on the body"
Curam,The pot
Curap,"Curapcurap, the opening and closing of the eyes, batting of eyelids, like, one badly awakened, or one whose eyes are irritated"
Curo,"Cacuro, one handful, what can be contained in one hand, like, one takingadouble handful, but using only one hand"
Curuc,Curucan
Curug,"Curugcurug, the noise caused by galloping horses, or when children run or romp in the room of the convent if the flooring is made of wood"
Curul,"Said ofabrave and invincible warrior when it happens that he has to retreat, or, if the steel sword, despite its sharpness, misses its target"
Cusa,willingness; initiative; doing something of ones own accord
Cusad,to crawl (of a snake or reptile)
Cuscus,Icuscus
Cusisap,"Meguing cusisap, said ofathing that is very thick, or dense, like, luxuriant growth /foliage, like the palay that is leafy or luxuriant"
Cusut,Icusut
Dabal,corpulent; misshapen body
Dabilbil,whizzing sound of rapidly flowing water
Dabulbul,a part in relation to the whole
Dagatag,large adjustable shade or awning (used by vendors against the sun)
Dagdag,to add; addition
Dag-Glus,hurriedly; in a rush
Dagma,"the cause of sinking, crushing, or falling down"
Dagsa,to topple or cause something to fall down
Daguis,mushroom (payung daguis)
Dagul,magnitude; greatness; enormity
Dagulgul,to beat or pound
Dagus,to slide down
Dayon,to take a stroll or go for a walk
Dayi,relative; of the same lineage or bloodline
Dait,washboard; a thin plank at the side of a boat that deflects wash
Dayupay,fully-winged locust
Dayuput,density; thickness
Dala,"Ica and Maca: Non nino ing tambing cuman alimbauang icaral quing casiran ding aliua, iyan totong maganaca"
Dalacdac,"Maralacdac, ablazing, abundance of flames, past, Me, also Dalacdacan, delacdacan"
Dalag,"Mudfish, a well known species of fish"
Dala?A,"A d jectiv e , a singlewo man , ayo ung maiden bef ore gettingm arr ie d"
Dalamat,to become contiguous; to adhere or stick to (like a stain or scab)
Dalampang,to stumble while walking (like a child or elderly person learning to walk)
Dalampasig,sandy shoreline; beach or riverbank
Dalampo,"N eutral verb , tohu mbleon ese lfbe forean o ther, m aeparalam po"
Dalampul,N eutral verban d that
Dalan,"N oun , road , whe reon epa sse sor walk s, phy s icallyan dmorally"
Dalandan,"A species of citrus, fruits are orange in color, also called, cajel, from Spanish"
Dalan?At,"At one time or another, it is said of men beset by sudden fear"
Dalapdap,Also the covering of the ambi (awning) in relation to the roof
Dalaquit,"Past, delaquit, what was carried across"
Dalarac,"N oun , thos esticks /rods onw h ichth e (pinaud) n ipathatchings a re fastene d to thedingding (sidings,)"
Dalas,"N oun , hurr iedrepe titiono fwh ato neisdo in g"
Dalauo,"N oun , aho le"
Dalaua,"M aralaua, m araralaua, a treeb eco m ingc lear and d isen gag edfromth icke ts : and a treer are lyuse d"
Daldac,"A ndits in fin itiv e , daldac"
Daldal,to crumple or rumple cloth; to crush
Daleray,N eutral verban d that
Dali,"N oun , O nef inge rwid th"
Dalicat,"N oun , V isco u s , lik e , p itc h , resin , orb itume n , hon eyo rco mbinationo f ingred ients"
Dalig,"Dingding, a siding made of wood"
Dalirul,Spout of water
Dalit,"Couplet, ballad, Pampango song"
Dalit-Ta,Magdalita
Daliuauat,Pimples that appear or come out on the face
Daloc,to help hammer iron on the same anvil
Dalong,"Complaint, groan, resentment"
Dalpac,"Past, Dilpac, that which is trampled"
Dalucduc,"The place, or to whom one goes to frighten, like, toacompanion one swims with"
Dalugdug,"N oun , gre atg rowthof ama n , orp lant, orb eas t"
Dalungdung,"Synonymof Balungbung, ashadeput upin thericefield"
Dalus,occurrences following one after another in sequence
Dalusdus,to slide downhill; to go down a slope
Dalusung,"Neutralverbandits infin itive , M anyalusong, tocomew ithvio lence , to rushanda ttack , likeonego ingtoassau ltsomeon e"
Dam,to ask for a loan; to borrow for a short time
Damac,a measure of five fingers; the width of the palm of the hand
Damag,a heavy object balanced at its center
Damal,Damalan
Damali,The past favors or good deeds with which
Dambo,"And its frequentative, mazdambodambo to go stomping, or make stomping steps when vexed or irritated, like children when asked or commanded to do some task"
Dambuala,"Mammoth, or sea monster, oralarge sea mammal, like the whale"
Dambobo,"To kick, or stomp angrily duringadispute or quarrel"
Dambong,"Citer, summoner"
Damdam,to sense; to feel; to perceive
Damil,melted or smashed flat; flattened (like cheese or a French roll)
Damit,to seize; to snap at prey (as a hawk does)
Damitac,"NeutralverbofMa, m aram itac"
Damla,good name; good reputation; generosity
Dampang,to walk unsteadily from weakness
Dampal,to slap with an open hand
Dampi,"N oun , thea rtof hea lin g /app ly ingm edic in e , e ither w ithaw a rmbric k , orw ithho t ashes"
Dampul,"A dye made from porks blood and certain tree barks, used in dyeing nets"
Damput,What is taken in all these ways
Damucu,A species of little black crabs
Damulag,carabao; water buffalo
Damulas,A barge of logs or planks fastened with rattan
Damul,"Synonym of Damil, Dampul"
Damuro,"A herb, its grains are like Anis"
Damusac,"Or Damutac, Active verb and its infinitive, manvamusac"
Damut,"Damutyapaman?an, a beast with little food, sparse to eat; Damutya catauan, one who hasalittle, or lean/thin body; Damutya quing biena, to belittle oneself, or one having little in life, or lives miserably, become miserable in life"
Dan,"The part ofaleg that is above the heel, serves asasupport of the whole leg"
Danac,"Ective, said ofaseeding field that is irrigated well (that is not laun), Danacya"
Danay,Continate
Dangcao,"The space or interval between the steps, Dinscaoan"
Dangcan?Ao,Abird like the heron
Dangdang,"Extremity, end point"
Dan?In,"Spoils/booty in war, like war trophies; those of the negritos are heads of their enemies"
Danglay,"Past, Dinglay, that which is cleared or removed"
Dangpa,"A hut, kiosk, or shepherds hut, whose roof slants to only one side"
Dantit,Dantic
Danun,"To anticipate, act ahead / early, (it is a Latin trait)"
Danup,Hunger
Dapal,"Haste, hurry"
Dapat,"N oun , work , inge nera l"
Dapil,flattened or crushed (as a soft fruit)
Dapilpil,Synonymof Dapulpul
Dap-Pius,to slip; to go astray (as a knife or arrow that goes too far off target)
Dapo,"N oun , cro cod ile"
Dapuc,to put or place something into a vessel or basket
Dapug,"N oun , bon fireof cow -dun g , etc"
Dapuli,two fighters who fall at the same time; a draw with no victor
Dapulpul,"2, past, Depulpul, the one who defeats an opponent in this manner"
Daput,"Merely, yet"
Daquit,"That with which, or the means, like an ox, a horse, etc"
Dara,"Aunt, or stepmother"
Darac,"Rice bran, which results from the dasdas (pounding of rice), the rice husks/hulls reduced to powder"
Darang,Mandarang
Daras,An adze
Data,"Weeds among the palay, wheat; & verb, Manyata, to pull out the weeds"
Datang,"Is saidof many, it is equivalent to to arrive"
Dati,Macarati
Datig,"Contiguous, adjacent"
Datila,to hold something in ones heart; to persevere
Datna,Modest composure
Dato,A chieftain
Datoc,Syncopate of Dapuc
Daton,Synonymof Dapuc
Dicdic,Crust on the head
Dicut,"Grass, in general"
Dila,The tongue
Dilat,"Macarilat, sticking out the tongue thus; also, stick out the tongue in contempt"
Dildil,"Also, dildil, adjectival noun, disgusting, nasty thing, objectionable or displeasing to the eye, loathsome to See filthy in aspect"
Dili,"Solely, alone"
Dilis,"String, cord, in general: rarely used"
Dilo,Diluan
Dimit,to sew or stitch fabric
Dingding,Walls or sidings made of nipa
Din?In,"Meguin dingin, the sourest, most sour"
Dinglas,A species of shrimps
Diquil,"The part allotted to anyone by distribution, or by fate/fortune, or by accident"
Diquing,"Lower place, opposite of Siduan, which is theprincipal place"
Diquit,"Miriquit, two sticking to each other.; Miriquitdiquit, if many"
Diri,"Nausea, loathsomeness"
Diris,"Musk, civet cat"
Dirxt,Few/little
Dit-Ta,"A species of cane, from which arrows are made"
Ditac,"Little, few"
Diua,Ruddiness
Diuata,Those that are taken for idols and false gods
Durao,Dumurao
Duac,"Medium, lesser, smaller"
Duay,"Disordered appetite, like of gluttony, or of lust"
Dubasa,"The lower horizontal half of the coconut shell, used as drinking cup or vessel"
Ducal,To become nauseated before throwing up; the stomach turning up beforeathrow up
Ducduc,"Said of people whose head is so close to the shoulders, and thus, appear to be withoutaneck, like an Asturian"
Duco,"Past, Dico, the head.P"
Ducul,"A bump, contusion/ lump, orahump on an uneven road"
Ducut,"And that of Mi, to stoop, or become bent or stooped, like one who carriesaburden on his back"
Dugal,Fervent desire
Dugarug,Manduearus
Dugdug,Manvueduz
Dugmo,"The victim, or the one struck in this manner"
Dugo,Chummy
Dugtung,Dunetum
Duyi,"Spine of fish, fishbones"
Duyan,hammock; swing
Dulum,"To decline, to wane, the moon"
Dulun,"The limit, boundary, and also what is contiguous with my land, I am the owner thereof, Dulun cu ya"
Dulung,"What goes down the river, embarking through it"
Dulut,"The food that those eating at table, give to their children, or relatives, or the desserts that they serve at the table, like oranges, suman, &"
